{
  "record_id": "SKR.BS.1.4.041",
  "work_code": "BS",
  "section_code": "1.4",
  "source": {
    "source_url": "https://advaitasharada.sringeri.net/display/bhashya/BS/devanagari?id=BS_C01&page=1",
    "source_sha256": "3e25449a44a0e912318db91030eb2e604e0c4eb2f8b5ceaa4ff4f92ae5e5bb80",
    "language": "sa",
    "script": "Devanagari",
    "edition_note": "Draft block record from BS_C01_S04.json::BS_C01_S04_V15_I01 (leading_bhashya)."
  },
  "text": {
    "source_text": "यत्पुनः कारणविषयं विगानं दर्शितम् ‘ असद्वा इदमग्र आसीत् ’ (तै. उ. २ । ७ । १) इत्यादि , तत्परिहर्तव्यम् ; अत्रोच्यते —",
    "transliteration_iast": "yatpunaḥ kāraṇaviṣayaṃ vigānaṃ darśitam ‘ asadvā idamagra āsīt ’ (tai. u. 2 | 7 | 1) ityādi , tatparihartavyam ; atrocyate —",
    "segmentation_note": "Block-level extraction from BS_C01_S04_V15/BS_C01_S04_V15_I01."
  },
  "translation": {
    "literal_translation": "As for the discrepancy raised regarding the cause, from statements such as 'in the beginning this was asat,' that too must be answered. The reply is now given.",
    "technical_translation": "Transition line: introduces formal resolution of the asat-based causal objection and signals that prior Brahman-causality conclusions remain to be defended via contextual pull-through.",
    "interpretive_note": "Lead-in to sutra 1.4.15's reconciliation method."
  },
  "analysis": {
    "lexical_notes": [
      {
        "headword_iast": "adhikaraṇa",
        "gloss": "topical unit of argument",
        "contextual_sense": "Tracks each block inside the section-level inferential sequence",
        "grammatical_role": "noun",
        "alternate_glosses": ["topic-unit", "argument node"]
      }
    ],
    "argument_tags": ["objection", "response"]
  },
  "provenance": {
    "extraction_timestamp_utc": "2026-06-02T16:24:50Z",
    "extractor_version": "extract_bs_records.py@0.1",
    "translator_version": "human+llm@bs-c01-s04-curation-pass-5",
    "reviewer_version": "pending",
    "source_manifest_path": "reality/src/logos/sankara/raw/manifest.jsonl"
  },
  "qa": {
    "status": "draft",
    "confidence": 0.82,
    "uncertainty_notes": [
      "Rendered as a transition statement; full argument is distributed across adjacent records.",
      "Asat citation interpretation should be checked against your final section-level style sheet."
    ]
  }
}
