{
  "record_id": "SKR.BS.1.1.020",
  "work_code": "BS",
  "section_code": "1.1",
  "source": {
    "source_url": "https://advaitasharada.sringeri.net/display/bhashya/BS/devanagari",
    "source_sha256": "3e25449a44a0e912318db91030eb2e604e0c4eb2f8b5ceaa4ff4f92ae5e5bb80",
    "language": "sa",
    "script": "Devanagari",
    "edition_note": "Auto-extracted draft from Sringeri HTML witness"
  },
  "text": {
    "source_text": "तत्तु समन्वयात् ॥ ४ ॥",
    "transliteration_iast": "",
    "segmentation_note": "Auto-segmented from HTML block id=BS_C01_S01_V04_SUTRA class=versetext"
  },
  "translation": {
    "literal_translation": "DRAFT literal translation pending philological pass.",
    "technical_translation": "DRAFT technical translation pending doctrinal terminology review.",
    "interpretive_note": ""
  },
  "analysis": {
    "lexical_notes": [
      {
        "headword_iast": "todo-term",
        "gloss": "pending",
        "contextual_sense": "Add lexical analysis during translation pass.",
        "grammatical_role": "unknown",
        "alternate_glosses": []
      }
    ],
    "argument_tags": [
      "definition"
    ]
  },
  "provenance": {
    "extraction_timestamp_utc": "2026-06-01T11:27:43.626182Z",
    "extractor_version": "generate_bs_draft_records.py@0.1",
    "translator_version": "human+llm@draft",
    "reviewer_version": "pending",
    "source_manifest_path": "ref/sankara/raw_full_safe/manifest.jsonl"
  },
  "qa": {
    "status": "draft",
    "confidence": 0.25,
    "uncertainty_notes": [
      "Auto-generated from BS_C01_S01_V04_SUTRA; translation not started.",
      "Source witness should be cross-checked against critical edition before approval."
    ]
  }
}
