{
  "record_id": "SKR.BS.1.3.080",
  "work_code": "BS",
  "section_code": "1.3",
  "source": {
    "source_url": "https://advaitasharada.sringeri.net/display/bhashya/BS/devanagari?id=BS_C01&page=1",
    "source_sha256": "3e25449a44a0e912318db91030eb2e604e0c4eb2f8b5ceaa4ff4f92ae5e5bb80",
    "language": "sa",
    "script": "Devanagari",
    "edition_note": "Draft block record from BS_C01_S03.json::BS_C01_S03_V32_I01 (leading_bhashya)."
  },
  "text": {
    "source_text": "कुतश्च देवादीनामनधिकारः —",
    "transliteration_iast": "kutaśca devādīnāmanadhikāraḥ —",
    "segmentation_note": "Block-level extraction from BS_C01_S03_V32/BS_C01_S03_V32_I01."
  },
  "translation": {
    "literal_translation": "And on what further grounds is there non-eligibility of gods and others?",
    "technical_translation": "Leading transition line introducing additional grounds for the deva-anadhikara argument.",
    "interpretive_note": "Sets up the next argumentative subdivision."
  },
  "analysis": {
    "lexical_notes": [
      {
        "headword_iast": "adhikaraṇa",
        "gloss": "topical unit of argument",
        "contextual_sense": "Tracks each block inside the section-level inferential sequence",
        "grammatical_role": "noun",
        "alternate_glosses": [
          "topic-unit",
          "argument node"
        ]
      }
    ],
    "argument_tags": [
      "objection"
    ]
  },
  "provenance": {
    "extraction_timestamp_utc": "2026-06-02T16:24:50Z",
    "extractor_version": "extract_bs_records.py@0.1",
    "translator_version": "human+llm@bs-c01-s03-curation-pass-10",
    "reviewer_version": "pending",
    "source_manifest_path": "reality/src/logos/sankara/raw/manifest.jsonl"
  },
  "qa": {
    "status": "draft",
    "confidence": 0.89,
    "uncertainty_notes": [
      "Curated in contiguous S03 pass with stable cadence and inferential-tag schema.",
      "A later philological pass should revisit pramana and upasana technical vocabulary in records 1.3.076-1.3.079."
    ]
  }
}
