{
  "record_id": "SKR.BS.1.1.061",
  "work_code": "BS",
  "section_code": "1.1",
  "source": {
    "source_url": "https://advaitasharada.sringeri.net/display/bhashya/BS/devanagari?id=BS_C01&page=1",
    "source_sha256": "3e25449a44a0e912318db91030eb2e604e0c4eb2f8b5ceaa4ff4f92ae5e5bb80",
    "language": "sa",
    "script": "Devanagari",
    "edition_note": "Draft block record from BS_C01_S01.json::BS_C01_S01_V15_VERSETEXT_01 (versetext)."
  },
  "text": {
    "source_text": "मान्त्रवर्णिकमेव च गीयते ॥ १५ ॥",
    "transliteration_iast": "māntravarṇikameva ca gīyate || 15 ||",
    "segmentation_note": "Block-level extraction from BS_C01_S01_V15/BS_C01_S01_V15_VERSETEXT_01."
  },
  "translation": {
    "literal_translation": "And it is sung as that very one described in the mantra. (15)",
    "technical_translation": "Sutra 1.1.15: anandamaya corresponds to the Brahman already described in the mantra section.",
    "interpretive_note": "Sutra affirms mantra-brahmana referential identity."
  },
  "analysis": {
    "lexical_notes": [
      {
        "headword_iast": "māntra-varṇikam eva ca gīyate",
        "gloss": "indeed it is sung as the very one described in the mantra",
        "contextual_sense": "Sutra seals identity between anandamaya referent and earlier mantra-defined Brahman.",
        "grammatical_role": "sutra phrase",
        "alternate_glosses": [
          "mantra-described same referent",
          "mantric identity affirmation"
        ]
      },
      {
        "headword_iast": "varṇika-sāmya",
        "gloss": "agreement with prior descriptive wording",
        "contextual_sense": "Shared descriptors across passages are treated as strong referential evidence.",
        "grammatical_role": "compound noun",
        "alternate_glosses": [
          "descriptive concordance",
          "qualifier alignment"
        ]
      },
      {
        "headword_iast": "prastuta-brahma-anvaya",
        "gloss": "continuity with currently discussed Brahman",
        "contextual_sense": "The already-established subject remains operative through the anandamaya discussion.",
        "grammatical_role": "compound noun",
        "alternate_glosses": [
          "present-topic Brahman linkage",
          "ongoing subject continuity"
        ]
      },
      {
        "headword_iast": "sūtra-parisamāpti-lakṣaṇa",
        "gloss": "marker of concluding determination",
        "contextual_sense": "Functions as closure-sign for this segment of the anandamaya adjudication chain.",
        "grammatical_role": "compound noun",
        "alternate_glosses": [
          "closure indicator",
          "terminal adjudicative marker"
        ]
      }
    ],
    "argument_tags": [
      "resolution"
    ]
  },
  "provenance": {
    "extraction_timestamp_utc": "2026-06-02T16:24:50Z",
    "extractor_version": "extract_bs_records.py@0.1",
    "translator_version": "human+llm@bs-c01-s01-curation-pass-8",
    "reviewer_version": "pending",
    "source_manifest_path": "reality/src/logos/sankara/raw/manifest.jsonl"
  },
  "qa": {
    "status": "draft",
    "confidence": 0.97,
    "uncertainty_notes": [
      "Curated in contiguous S01 pass with stable inferential-tag schema.",
      "A later philological pass should revisit mayat suffix semantics and anandamaya mantra-brahmana continuity framing in records 1.1.056-1.1.063."
    ]
  }
}
