{
  "record_id": "SKR.BS.1.1.040",
  "work_code": "BS",
  "section_code": "1.1",
  "source": {
    "source_url": "https://advaitasharada.sringeri.net/display/bhashya/BS/devanagari?id=BS_C01&page=1",
    "source_sha256": "3e25449a44a0e912318db91030eb2e604e0c4eb2f8b5ceaa4ff4f92ae5e5bb80",
    "language": "sa",
    "script": "Devanagari",
    "edition_note": "Draft block record from BS_C01_S01.json::BS_C01_S01_V08_B1 (bhashya)."
  },
  "text": {
    "source_text": "यद्यनात्मैव प्रधानं सच्छब्दवाच्यम् ‘ स आत्मा तत्त्वमसि ’ इतीहोपदिष्टं स्यात् ; स तदुपदेशश्रवणादनात्मज्ञतया तन्निष्ठो मा भूदिति , मुख्यमात्मानमुपदिदिक्षु शास्त्रं तस्य हेयत्वं ब्रूयात् । यथारुन्धतीं दिदर्शयिषुस्तत्समीपस्थां स्थूलां ताराममुख्यां प्रथममरुन्धतीति ग्राहयित्वा , तां प्रत्याख्याय , पश्चादरुन्धतीमेव ग्राहयति ; तद्वन्नायमात्मेति ब्रूयात् । न चैवमवोचत् । सन्मात्रात्मावगतिनिष्ठैव हि षष्ठप्रपाठकपरिसमाप्तिर्दृश्यते । चशब्दः प्रतिज्ञाविरोधाभ्युच्चयप्रदर्शनार्थः । सत्यपि हेयत्ववचने प्रतिज्ञाविरोधः प्रसज्येत । कारणविज्ञानाद्धि सर्वं विज्ञातमिति प्रतिज्ञातम् — ‘ उत तमादेशमप्राक्ष्यो येनाश्रुतꣳ श्रुतं भवत्यमतं मतमविज्ञातं विज्ञातमिति ; कथं नु भगवः स आदेशो भवतीति ’ (छा. उ. ६ । १ । ३) ; ‘ यथा सोम्यैकेन मृत्पिण्डेन सर्वं मृन्मयं विज्ञातं स्या द्वाचा रम्भणं विकारो नामधेयं मृत्तिके त्येव सत्यम् ’ (छा. उ. ६ । १ । ४) ‘ एवं सोम्य स आदेशो भवति ’ (छा. उ. ६ । १ । ६) इति वाक्योपक्रमे श्रवणात् । न च सच्छब्दवाच्ये प्रधाने भोग्यवर्गकारणे हेयत्वेनाहेयत्वेन वा विज्ञाते भोक्तृवर्गो विज्ञातो भवति , अप्रधानविकारत्वाद्भोक्तृवर्गस्य । तस्मान्न प्रधानं सच्छब्दवाच्यम् ॥ ८ ॥",
    "transliteration_iast": "yadyanātmaiva pradhānaṃ sacchabdavācyam ‘ sa ātmā tattvamasi ’ itīhopadiṣṭaṃ syāt ; sa tadupadeśaśravaṇādanātmajñatayā tanniṣṭho mā bhūditi , mukhyamātmānamupadidikṣu śāstraṃ tasya heyatvaṃ brūyāt | yathārundhatīṃ didarśayiṣustatsamīpasthāṃ sthūlāṃ tārāmamukhyāṃ prathamamarundhatīti grāhayitvā , tāṃ pratyākhyāya , paścādarundhatīmeva grāhayati ; tadvannāyamātmeti brūyāt | na caivamavocat | sanmātrātmāvagatiniṣṭhaiva hi ṣaṣṭhaprapāṭhakaparisamāptirdṛśyate | caśabdaḥ pratijñāvirodhābhyuccayapradarśanārthaḥ | satyapi heyatvavacane pratijñāvirodhaḥ prasajyeta | kāraṇavijñānāddhi sarvaṃ vijñātamiti pratijñātam — ‘ uta tamādeśamaprākṣyo yenāśrutam̐ śrutaṃ bhavatyamataṃ matamavijñātaṃ vijñātamiti ; kathaṃ nu bhagavaḥ sa ādeśo bhavatīti ’ (chā. u. 6 | 1 | 3) ; ‘ yathā somyaikena mṛtpiṇḍena sarvaṃ mṛnmayaṃ vijñātaṃ syā dvācā rambhaṇaṃ vikāro nāmadheyaṃ mṛttike tyeva satyam ’ (chā. u. 6 | 1 | 4) ‘ evaṃ somya sa ādeśo bhavati ’ (chā. u. 6 | 1 | 6) iti vākyopakrame śravaṇāt | na ca sacchabdavācye pradhāne bhogyavargakāraṇe heyatvenāheyatvena vā vijñāte bhoktṛvargo vijñāto bhavati , apradhānavikāratvādbhoktṛvargasya | tasmānna pradhānaṃ sacchabdavācyam || 8 ||",
    "segmentation_note": "Block-level extraction from BS_C01_S01_V08/BS_C01_S01_V08_B1."
  },
  "translation": {
    "literal_translation": "If non-self Pradhana denoted by sat were what is taught in 'that self, thou art,' then after hearing that instruction the seeker might wrongly become established in non-self cognition. In that case scripture, intending to teach the true primary self, should declare that taught item rejectable - like one showing Arundhati first points to a nearby large star, then rejects it and finally indicates Arundhati. It should have said, 'this is not the self.' But it does not. Rather the sixth chapter clearly ends in establishment in self-as-sat alone. Also, even if one tried to add a rejectability statement, contradiction with the chapter's initial pledge would arise: by knowing the cause, all is known ('did you ask for that instruction by which the unheard becomes heard...'; 'by one lump of clay all made of clay is known...'). If sat meant Pradhana as cause of the enjoyables, then whether known as rejectable or non-rejectable, the enjoyer-class would still remain unknown, since enjoyers are not modifications of Pradhana in that sense. Therefore Pradhana is not what sat denotes. (8)",
    "technical_translation": "Bhashya on 1.1.8 argues from absence of heya-vacana and from ekavijnanena sarvavijnana pratijna coherence: sat in tat tvam asi cannot be Pradhana.",
    "interpretive_note": "Pedagogical structure and opening promise jointly rule out Pradhana reading."
  },
  "analysis": {
    "lexical_notes": [
      {
        "headword_iast": "heya-vacana-abhāva",
        "gloss": "absence of discard-instruction",
        "contextual_sense": "No scriptural move marks sat as something to abandon, unlike provisional pointing devices.",
        "grammatical_role": "compound noun",
        "alternate_glosses": [
          "no rejection directive",
          "absence of renunciation cue"
        ]
      },
      {
        "headword_iast": "arundhatī-nyāya",
        "gloss": "Arundhati teaching method analogy",
        "contextual_sense": "Used to show when provisional designation is intended, text explicitly retracts it later.",
        "grammatical_role": "illustrative compound",
        "alternate_glosses": [
          "progressive-pointing pedagogy",
          "indirect indication model"
        ]
      },
      {
        "headword_iast": "ekavijñānena sarvavijñāna-pratijñā",
        "gloss": "pledge that one knowledge yields all knowledge",
        "contextual_sense": "Opening promise would fail if sat denoted only a partial material principle.",
        "grammatical_role": "compound doctrinal phrase",
        "alternate_glosses": [
          "one-knowing-all pledge",
          "total-knowledge through single insight"
        ]
      },
      {
        "headword_iast": "pratijñā-upapatti",
        "gloss": "fulfillment of initial thesis",
        "contextual_sense": "Hermeneutic reading must preserve the chapter’s declared pedagogical aim.",
        "grammatical_role": "compound noun",
        "alternate_glosses": [
          "thesis coherence",
          "promise-justification"
        ]
      },
      {
        "headword_iast": "sat-śabda-brahma-paratva",
        "gloss": "sat-word oriented to Brahman",
        "contextual_sense": "Conclusion secures non-provisional referent across teaching sequence.",
        "grammatical_role": "compound noun",
        "alternate_glosses": [
          "being-term as Brahman-reference",
          "sat-denotation finality"
        ]
      }
    ],
    "argument_tags": [
      "response",
      "resolution",
      "definition",
      "example"
    ]
  },
  "provenance": {
    "extraction_timestamp_utc": "2026-06-02T16:24:50Z",
    "extractor_version": "extract_bs_records.py@0.1",
    "translator_version": "human+llm@bs-c01-s01-curation-pass-6",
    "reviewer_version": "pending",
    "source_manifest_path": "reality/src/logos/sankara/raw/manifest.jsonl"
  },
  "qa": {
    "status": "draft",
    "confidence": 0.87,
    "uncertainty_notes": [
      "Curated in contiguous S01 pass with stable inferential-tag schema.",
      "A later philological pass should revisit svapya etymological nuances and gati-samanya phrasing in records 1.1.040-1.1.047."
    ]
  }
}
