{
  "record_id": "SKR.BS.1.2.027",
  "work_code": "BS",
  "section_code": "1.2",
  "source": {
    "source_url": "https://advaitasharada.sringeri.net/display/bhashya/BS/devanagari?id=BS_C01&page=1",
    "source_sha256": "3e25449a44a0e912318db91030eb2e604e0c4eb2f8b5ceaa4ff4f92ae5e5bb80",
    "language": "sa",
    "script": "Devanagari",
    "edition_note": "Draft block record from BS_C01_S02.json::BS_C01_S02_V11_B3 (bhashya)."
  },
  "text": {
    "source_text": "विज्ञानात्मपरमात्मानाविहोच्येयाताम् । कस्मात् ? आत्मानौ हि तावुभावपि चेतनौ समानस्वभावौ । संख्याश्रवणे च समानस्वभावेष्वेव लोके प्रतीतिर्दृश्यते । ‘ अस्य गोर्द्वितीयोऽन्वेष्टव्यः ’ इत्युक्ते , गौरेव द्वितीयोऽन्विष्यते , नाश्वः पुरुषो वा । तदिह ऋतपानेन लिङ्गेन निश्चिते विज्ञानात्मनि द्वितीयान्वेषणायां समानस्वभावश्चेतनः परमात्मैव प्रतीयते । ननूक्तं गुहाहितत्वदर्शनान्न परमात्मा प्रत्येतव्य इति ; गुहाहितत्वदर्शनादेव परमात्मा प्रत्येतव्य इति वदामः । गुहाहितत्वं तु श्रुतिस्मृतिष्वसकृत्परमात्मन एव दृश्यते — ‘ गुहाहितं गह्वरेष्ठं पुराणम् ’ (क. उ. १ । २ । १२) ‘ यो वेद निहितं गुहायां परमे व्योमन् ’ (तै. उ. २ । १ । १) ‘ आत्मानमन्विच्छ गुहां प्रविष्टम् ’ इत्याद्यासु । सर्वगतस्यापि ब्रह्मण उपलब्ध्यर्थो देशविशेषोपदेशो न विरुध्यत इत्येतदप्युक्तमेव । सुकृतलोकवर्तित्वं तु च्छत्रित्ववदेकस्मिन्नपि वर्तमानमुभयोरविरुद्धम् । ‘ छायातपौ ’ इत्यप्यविरुद्धम् ; छायातपवत्परस्परविलक्षणत्वात्संसारित्वासंसारित्वयोः , अविद्याकृतत्वात्संसारित्वस्य पारमार्थिकत्वाच्चासंसारित्वस्य । तस्माद्विज्ञानात्मपरमात्मानौ गुहां प्रविष्टौ गृह्येते ॥ ११ ॥",
    "transliteration_iast": "vijñānātmaparamātmānāvihocyeyātām | kasmāt ? ātmānau hi tāvubhāvapi cetanau samānasvabhāvau | saṃkhyāśravaṇe ca samānasvabhāveṣveva loke pratītirdṛśyate | ‘ asya gordvitīyo'nveṣṭavyaḥ ’ ityukte , gaureva dvitīyo'nviṣyate , nāśvaḥ puruṣo vā | tadiha ṛtapānena liṅgena niścite vijñānātmani dvitīyānveṣaṇāyāṃ samānasvabhāvaścetanaḥ paramātmaiva pratīyate | nanūktaṃ guhāhitatvadarśanānna paramātmā pratyetavya iti ; guhāhitatvadarśanādeva paramātmā pratyetavya iti vadāmaḥ | guhāhitatvaṃ tu śrutismṛtiṣvasakṛtparamātmana eva dṛśyate — ‘ guhāhitaṃ gahvareṣṭhaṃ purāṇam ’ (ka. u. 1 | 2 | 12) ‘ yo veda nihitaṃ guhāyāṃ parame vyoman ’ (tai. u. 2 | 1 | 1) ‘ ātmānamanviccha guhāṃ praviṣṭam ’ ityādyāsu | sarvagatasyāpi brahmaṇa upalabdhyartho deśaviśeṣopadeśo na virudhyata ityetadapyuktameva | sukṛtalokavartitvaṃ tu cchatritvavadekasminnapi vartamānamubhayoraviruddham | ‘ chāyātapau ’ ityapyaviruddham ; chāyātapavatparasparavilakṣaṇatvātsaṃsāritvāsaṃsāritvayoḥ , avidyākṛtatvātsaṃsāritvasya pāramārthikatvāccāsaṃsāritvasya | tasmādvijñānātmaparamātmānau guhāṃ praviṣṭau gṛhyete || 11 ||",
    "segmentation_note": "Block-level extraction from BS_C01_S02_V11/BS_C01_S02_V11_B3."
  },
  "translation": {
    "literal_translation": "The two taught here should be the knowing self and the Supreme Self. Why? Both are selves, conscious, and same in kind; in ordinary usage, when two are mentioned, the second is expected from same class. If told 'find a second cow for this cow,' one seeks another cow, not a horse or person. Here, once one member is fixed as conscious knower by the sign of drinking, the second is naturally grasped as another conscious same-kind reality, namely the Supreme. Objection: cave-entry shows it is not Supreme. Reply: cave-reference itself supports Supreme, since shruti and smriti repeatedly describe the Supreme as cave-seated ('hidden in the cave,' 'deposited in the cave in highest ether,' 'seek the self entered into the cave'). Also, teaching a particular locus for realizing even all-pervasive Brahman is non-contradictory, as already explained. Residence in merit-world can be understood for both as in cases like umbrella-designation. 'Shadow and light' too is consistent: samsaric and non-samsaric are mutually distinct like shadow and sunlight; samsaric status is ignorance-made, while non-samsaric status is ultimate. Therefore the pair entered in the cave should be taken as knowing self and Supreme Self. (11)",
    "technical_translation": "Bhashya on 1.2.11 establishes jiva-paramatma pairing via same-class dual reference principle, guhahita scriptural support, and qualified interpretation of sukrita/chaya-tapa descriptors.",
    "interpretive_note": "Converts each purvapaksha indicator into a pro-Brahman indicator by hermeneutic re-weighting."
  },
  "analysis": {
    "lexical_notes": [
      {
        "headword_iast": "vijnanatma-paramatma",
        "gloss": "individual cognizer and Supreme Self pair",
        "contextual_sense": "Siddhanta pairing accepted for the dual reference in the mantra.",
        "grammatical_role": "compound dyad",
        "alternate_glosses": [
          "jiva-Ishvara pair",
          "knower-Supreme dyad"
        ]
      },
      {
        "headword_iast": "samanasvabhava-dvaya",
        "gloss": "dual reference among same-class entities",
        "contextual_sense": "Principle that dual mention normally picks two of one ontological class (both conscious selves).",
        "grammatical_role": "compound noun",
        "alternate_glosses": [
          "same-nature duality",
          "class-consistent pairing rule"
        ]
      },
      {
        "headword_iast": "guhahita-pramana",
        "gloss": "scriptural evidence for indwelling in the cave",
        "contextual_sense": "Cited passages support both jiva and Paramatma as heart-cavity occupants.",
        "grammatical_role": "compound noun",
        "alternate_glosses": [
          "cave-indwelling testimony",
          "inner-heart witness text"
        ]
      },
      {
        "headword_iast": "chaya-tapa-vyakhya",
        "gloss": "interpretation of shade-sun imagery",
        "contextual_sense": "Read as asymmetrical relation within jiva-Paramatma dyad rather than buddhi-jiva pairing.",
        "grammatical_role": "compound noun",
        "alternate_glosses": [
          "shadow-light exegesis",
          "metaphor adjudication"
        ]
      },
      {
        "headword_iast": "siddhanta",
        "gloss": "settled conclusion",
        "contextual_sense": "Final determination displacing the buddhi-ksetrajna purvapaksa.",
        "grammatical_role": "noun",
        "alternate_glosses": [
          "final view",
          "doctrinal settlement"
        ]
      }
    ],
    "argument_tags": [
      "response",
      "resolution",
      "definition",
      "example"
    ]
  },
  "provenance": {
    "extraction_timestamp_utc": "2026-06-02T16:24:50Z",
    "extractor_version": "extract_bs_records.py@0.1",
    "translator_version": "human+llm@bs-c01-s02-curation-pass-4",
    "reviewer_version": "pending",
    "source_manifest_path": "reality/src/logos/sankara/raw/manifest.jsonl"
  },
  "qa": {
    "status": "draft",
    "confidence": 0.81,
    "uncertainty_notes": [
      "Curated in contiguous S02 pass with stable cadence and inferential-tag schema.",
      "A later philological pass should revisit sattva-kshetrajna and bhoktrtva figurative-usage choices in records 1.2.025-1.2.030."
    ]
  }
}
