{
  "record_id": "SKR.BS.1.3.058",
  "work_code": "BS",
  "section_code": "1.3",
  "source": {
    "source_url": "https://advaitasharada.sringeri.net/display/bhashya/BS/devanagari?id=BS_C01&page=1",
    "source_sha256": "3e25449a44a0e912318db91030eb2e604e0c4eb2f8b5ceaa4ff4f92ae5e5bb80",
    "language": "sa",
    "script": "Devanagari",
    "edition_note": "Draft block record from BS_C01_S03.json::BS_C01_S03_V24_VERSETEXT_01 (versetext)."
  },
  "text": {
    "source_text": "शब्दादेव प्रमितः ॥ २४ ॥",
    "transliteration_iast": "śabdādeva pramitaḥ || 24 ||",
    "segmentation_note": "Block-level extraction from BS_C01_S03_V24/BS_C01_S03_V24_VERSETEXT_01."
  },
  "translation": {
    "literal_translation": "Measured thus, by word alone. (24)",
    "technical_translation": "Sutra 1.3.24: the thumb-sized person is determined as Brahman by decisive scriptural designation.",
    "interpretive_note": "Sutra capsule of the ishana-word argument."
  },
  "analysis": {
    "lexical_notes": [
      {
        "headword_iast": "adhikaraṇa",
        "gloss": "topical unit of argument",
        "contextual_sense": "Tracks each block inside the section-level inferential sequence",
        "grammatical_role": "noun",
        "alternate_glosses": [
          "topic-unit",
          "argument node"
        ]
      }
    ],
    "argument_tags": [
      "resolution"
    ]
  },
  "provenance": {
    "extraction_timestamp_utc": "2026-06-02T16:24:50Z",
    "extractor_version": "extract_bs_records.py@0.1",
    "translator_version": "human+llm@bs-c01-s03-curation-pass-8",
    "reviewer_version": "pending",
    "source_manifest_path": "reality/src/logos/sankara/raw/manifest.jsonl"
  },
  "qa": {
    "status": "draft",
    "confidence": 0.91,
    "uncertainty_notes": [
      "Curated in contiguous S03 pass with stable cadence and inferential-tag schema.",
      "A later philological pass should revisit adhikara/karma technical vocabulary in records 1.3.062 and 1.3.064."
    ]
  }
}
