{
  "record_id": "SKR.BS.1.2.063",
  "work_code": "BS",
  "section_code": "1.2",
  "source": {
    "source_url": "https://advaitasharada.sringeri.net/display/bhashya/BS/devanagari?id=BS_C01&page=1",
    "source_sha256": "3e25449a44a0e912318db91030eb2e604e0c4eb2f8b5ceaa4ff4f92ae5e5bb80",
    "language": "sa",
    "script": "Devanagari",
    "edition_note": "Draft block record from BS_C01_S02.json::BS_C01_S02_V24_VERSETEXT_01 (versetext)."
  },
  "text": {
    "source_text": "वैश्वानरः साधारणशब्दविशेषात् ॥ २४ ॥",
    "transliteration_iast": "vaiśvānaraḥ sādhāraṇaśabdaviśeṣāt || 24 ||",
    "segmentation_note": "Block-level extraction from BS_C01_S02_V24/BS_C01_S02_V24_VERSETEXT_01."
  },
  "translation": {
    "literal_translation": "Vaishvanara, because of specification of a common word. (24)",
    "technical_translation": "Sutra 1.2.24: Vaisvanara denotes Brahman through specification constraining otherwise common lexical usage.",
    "interpretive_note": "Sutra seal for the sadharana-sabda-visesa criterion."
  },
  "analysis": {
    "lexical_notes": [
      {
        "headword_iast": "vaisvanarah",
        "gloss": "Vaisvanara (here as doctrinal referent)",
        "contextual_sense": "Sutra nominative subject fixed through contextual specialization.",
        "grammatical_role": "noun",
        "alternate_glosses": [
          "Vaisvanara principle",
          "universal-fire referent"
        ]
      },
      {
        "headword_iast": "sadharana-sabda-visesat",
        "gloss": "because of specification of common terms",
        "contextual_sense": "Aphoristic reason that lexical commonality is overridden by context-specific markers.",
        "grammatical_role": "ablative reason phrase",
        "alternate_glosses": [
          "from contextual disambiguation",
          "due to term-specification"
        ]
      },
      {
        "headword_iast": "sutra-hetu",
        "gloss": "sutra-level inferential reason",
        "contextual_sense": "Condenses broad bhashya semantics into one interpretive criterion.",
        "grammatical_role": "compound noun",
        "alternate_glosses": [
          "aphoristic rationale",
          "compressed ground"
        ]
      },
      {
        "headword_iast": "sabda-bheda-nirnaya",
        "gloss": "resolution by lexical differentiation",
        "contextual_sense": "Methodic closure of polysemy through qualifier-governed referential fixing.",
        "grammatical_role": "compound noun",
        "alternate_glosses": [
          "term-level adjudication",
          "semantic resolution"
        ]
      }
    ],
    "argument_tags": [
      "resolution"
    ]
  },
  "provenance": {
    "extraction_timestamp_utc": "2026-06-02T16:24:50Z",
    "extractor_version": "extract_bs_records.py@0.1",
    "translator_version": "human+llm@bs-c01-s02-curation-pass-9",
    "reviewer_version": "pending",
    "source_manifest_path": "reality/src/logos/sankara/raw/manifest.jsonl"
  },
  "qa": {
    "status": "draft",
    "confidence": 0.95,
    "uncertainty_notes": [
      "Curated in contiguous S02 pass with stable cadence and inferential-tag schema.",
      "A later philological pass should revisit vaisvanara lexical-rhetorical pivots and drsti-upadesa framing in records 1.2.063-1.2.070."
    ]
  }
}
