{
  "record_id": "SKR.BS.1.4.016",
  "work_code": "BS",
  "section_code": "1.4",
  "source": {
    "source_url": "https://advaitasharada.sringeri.net/display/bhashya/BS/devanagari?id=BS_C01&page=1",
    "source_sha256": "3e25449a44a0e912318db91030eb2e604e0c4eb2f8b5ceaa4ff4f92ae5e5bb80",
    "language": "sa",
    "script": "Devanagari",
    "edition_note": "Draft block record from BS_C01_S04.json::BS_C01_S04_V06_VERSETEXT_01 (versetext)."
  },
  "text": {
    "source_text": "त्रयाणामेव चैवमुपन्यासः प्रश्नश्च ॥ ६ ॥",
    "transliteration_iast": "trayāṇāmeva caivamupanyāsaḥ praśnaśca || 6 ||",
    "segmentation_note": "Block-level extraction from BS_C01_S04_V06/BS_C01_S04_V06_VERSETEXT_01."
  },
  "translation": {
    "literal_translation": "And indeed, in this way, there is exposition and question only of those three. (6)",
    "technical_translation": "Sutra 1.4.6: both the narrative presentation and interrogative structure are restricted to exactly three referents; therefore pradhana cannot be imported as a fourth topic.",
    "interpretive_note": "Formal closure of the tri-topic argument from Katha dialogue structure."
  },
  "analysis": {
    "lexical_notes": [
      {
        "headword_iast": "adhikaraṇa",
        "gloss": "topical unit of argument",
        "contextual_sense": "Tracks each block inside the section-level inferential sequence",
        "grammatical_role": "noun",
        "alternate_glosses": ["topic-unit", "argument node"]
      }
    ],
    "argument_tags": ["thesis", "resolution"]
  },
  "provenance": {
    "extraction_timestamp_utc": "2026-06-02T16:24:50Z",
    "extractor_version": "extract_bs_records.py@0.1",
    "translator_version": "human+llm@bs-c01-s04-curation-pass-2",
    "reviewer_version": "pending",
    "source_manifest_path": "reality/src/logos/sankara/raw/manifest.jsonl"
  },
  "qa": {
    "status": "draft",
    "confidence": 0.77,
    "uncertainty_notes": [
      "Sutra brevity is preserved and unpacked only in the technical line.",
      "Threefold referent reading is context-dependent on the adjoining bhashya blocks."
    ]
  }
}
