{
  "record_id": "SKR.BS.1.2.041",
  "work_code": "BS",
  "section_code": "1.2",
  "source": {
    "source_url": "https://advaitasharada.sringeri.net/display/bhashya/BS/devanagari?id=BS_C01&page=1",
    "source_sha256": "3e25449a44a0e912318db91030eb2e604e0c4eb2f8b5ceaa4ff4f92ae5e5bb80",
    "language": "sa",
    "script": "Devanagari",
    "edition_note": "Draft block record from BS_C01_S02.json::BS_C01_S02_V16_VERSETEXT_01 (versetext)."
  },
  "text": {
    "source_text": "श्रुतोपनिषत्कगत्यभिधानाच्च ॥ १६ ॥",
    "transliteration_iast": "śrutopaniṣatkagatyabhidhānācca || 16 ||",
    "segmentation_note": "Block-level extraction from BS_C01_S02_V16/BS_C01_S02_V16_VERSETEXT_01."
  },
  "translation": {
    "literal_translation": "And because of mention of the path of one who has heard the Upanishadic secret. (16)",
    "technical_translation": "Sutra 1.2.16: shrutopanishatka-gati attribution indicates Brahman, not a lower referent.",
    "interpretive_note": "Sutra shorthand for the devayana-identification argument."
  },
  "analysis": {
    "lexical_notes": [
      {
        "headword_iast": "adhikaraṇa",
        "gloss": "topical unit of argument",
        "contextual_sense": "Tracks each block inside the section-level inferential sequence",
        "grammatical_role": "noun",
        "alternate_glosses": [
          "topic-unit",
          "argument node"
        ]
      }
    ],
    "argument_tags": [
      "resolution"
    ]
  },
  "provenance": {
    "extraction_timestamp_utc": "2026-06-02T16:24:50Z",
    "extractor_version": "extract_bs_records.py@0.1",
    "translator_version": "human+llm@bs-c01-s02-curation-pass-6",
    "reviewer_version": "pending",
    "source_manifest_path": "reality/src/logos/sankara/raw/manifest.jsonl"
  },
  "qa": {
    "status": "draft",
    "confidence": 0.94,
    "uncertainty_notes": [
      "Curated in contiguous S02 pass with stable cadence and inferential-tag schema.",
      "A later philological pass should revisit antaryamin technical vocabulary and akshi-purusha predicate nuances in records 1.2.040-1.2.046."
    ]
  }
}
