{
  "record_id": "SKR.BS.1.4.006",
  "work_code": "BS",
  "section_code": "1.4",
  "source": {
    "source_url": "https://advaitasharada.sringeri.net/display/bhashya/BS/devanagari?id=BS_C01&page=1",
    "source_sha256": "3e25449a44a0e912318db91030eb2e604e0c4eb2f8b5ceaa4ff4f92ae5e5bb80",
    "language": "sa",
    "script": "Devanagari",
    "edition_note": "Draft block record from BS_C01_S04.json::BS_C01_S04_V03_B1 (bhashya)."
  },
  "text": {
    "source_text": "अत्राह — यदि जगदिदमनभिव्यक्तनामरूपं बीजात्मकं प्रागवस्थमव्यक्तशब्दार्हमभ्युपगम्येत , तदात्मना च शरीरस्याप्यव्यक्तशब्दार्हत्वं प्रतिज्ञायेत , स एव तर्हि प्रधानकारणवाद एवं सत्यापद्येत ; अस्यैव जगतः प्रागवस्थायाः प्रधानत्वेनाभ्युपगमादिति । अत्रोच्यते — यदि वयं स्वतन्त्रां काञ्चित्प्रागवस्थां जगतः कारणत्वेनाभ्युपगच्छेम , प्रसञ्जयेम तदा प्रधानकारणवादम् । परमेश्वराधीना त्वियमस्माभिः प्रागवस्था जगतोऽभ्युपगम्यते , न स्वतन्त्रा । सा चावश्याभ्युपगन्तव्या । अर्थवती हि सा । न हि तया विना परमेश्वरस्य स्रष्टृत्वं सिध्यति । शक्तिरहितस्य तस्य प्रवृत्त्यनुपपत्तेः । मुक्तानां च पुनरनुत्पत्तिः । कुतः ? विद्यया तस्या बीजशक्तेर्दाहात् । अवि द्यात्मिका हि बीजशक्तिरव्यक्तशब्दनिर्देश्या परमेश्वराश्रया मायामयी महासुषुप्तिः , यस्यां स्वरूपप्रतिबोधरहिताः शेरते संसारिणो जीवाः । तदेत दव्यक्तं क्वचिदाकाशशब्दनिर्दिष्टम् — ‘ एतस्मिन्नु खल्वक्षरे गार्ग्याकाश ओतश्च प्रोतश्च ’ (बृ. उ. ३ । ८ । ११) इति श्रुतेः ; क्वचिदक्षरशब्दोदितम् — ‘ अक्षरात्परतः परः ’ (मु. उ. २ । १ । २) इति श्रुतेः ; क्वचिन्मायेति सूचितम् — ‘ मायां तु प्रकृतिं विद्यान्मायिनं तु महेश्वरम् ’ (श्वे. उ. ४ । १०) इति मन्त्रवर्णात् । अव्यक्ता हि सा माया , तत्त्वान्यत्वनिरूपणस्याशक्यत्वात् । तदिदं ‘ महतः परमव्यक्तम् ’ इत्युक्तम् — अव्यक्तप्रभवत्वान्महतः , यदा हैरण्यगर्भी बुद्धिर्महान् । यदा तु जीवो महान् तदाप्यव्यक्ताधीनत्वाज्जीवभावस्य महतः परमव्यक्तमित्युक्तम् । अविद्या ह्यव्यक्तम् ; अविद्यावत्त्वेनैव जीवस्य सर्वः संव्यवहारः सन्ततो वर्तते । तच्च अव्यक्तगतं महतः परत्वमभेदोपचारात्तद्विकारे शरीरे परिकल्प्यते । सत्यपि शरीरवदिन्द्रियादीनां तद्विकारत्वाविशेषे शरीरस्यैवाभेदोपचारादव्यक्तशब्देन ग्रहणम् , इन्द्रियादीनां स्वशब्दैरेव गृहीतत्वात् , परिशिष्टत्वाच्च शरीरस्य ॥",
    "transliteration_iast": "atrāha — yadi jagadidamanabhivyaktanāmarūpaṃ bījātmakaṃ prāgavasthamavyaktaśabdārhamabhyupagamyeta , tadātmanā ca śarīrasyāpyavyaktaśabdārhatvaṃ pratijñāyeta , sa eva tarhi pradhānakāraṇavāda evaṃ satyāpadyeta ; asyaiva jagataḥ prāgavasthāyāḥ pradhānatvenābhyupagamāditi | atrocyate — yadi vayaṃ svatantrāṃ kāñcitprāgavasthāṃ jagataḥ kāraṇatvenābhyupagacchema , prasañjayema tadā pradhānakāraṇavādam | parameśvarādhīnā tviyamasmābhiḥ prāgavasthā jagato'bhyupagamyate , na svatantrā | sā cāvaśyābhyupagantavyā | arthavatī hi sā | na hi tayā vinā parameśvarasya sraṣṭṛtvaṃ sidhyati | śaktirahitasya tasya pravṛttyanupapatteḥ | muktānāṃ ca punaranutpattiḥ | kutaḥ ? vidyayā tasyā bījaśakterdāhāt | avi dyātmikā hi bījaśaktiravyaktaśabdanirdeśyā parameśvarāśrayā māyāmayī mahāsuṣuptiḥ , yasyāṃ svarūpapratibodharahitāḥ śerate saṃsāriṇo jīvāḥ | tadeta davyaktaṃ kvacidākāśaśabdanirdiṣṭam — ‘ etasminnu khalvakṣare gārgyākāśa otaśca protaśca ’ (bṛ. u. 3 | 8 | 11) iti śruteḥ ; kvacidakṣaraśabdoditam — ‘ akṣarātparataḥ paraḥ ’ (mu. u. 2 | 1 | 2) iti śruteḥ ; kvacinmāyeti sūcitam — ‘ māyāṃ tu prakṛtiṃ vidyānmāyinaṃ tu maheśvaram ’ (śve. u. 4 | 10) iti mantravarṇāt | avyaktā hi sā māyā , tattvānyatvanirūpaṇasyāśakyatvāt | tadidaṃ ‘ mahataḥ paramavyaktam ’ ityuktam — avyaktaprabhavatvānmahataḥ , yadā hairaṇyagarbhī buddhirmahān | yadā tu jīvo mahān tadāpyavyaktādhīnatvājjīvabhāvasya mahataḥ paramavyaktamityuktam | avidyā hyavyaktam ; avidyāvattvenaiva jīvasya sarvaḥ saṃvyavahāraḥ santato vartate | tacca avyaktagataṃ mahataḥ paratvamabhedopacārāttadvikāre śarīre parikalpyate | satyapi śarīravadindriyādīnāṃ tadvikāratvāviśeṣe śarīrasyaivābhedopacārādavyaktaśabdena grahaṇam , indriyādīnāṃ svaśabdaireva gṛhītatvāt , pariśiṣṭatvācca śarīrasya ||",
    "segmentation_note": "Block-level extraction from BS_C01_S04_V03/BS_C01_S04_V03_B1."
  },
  "translation": {
    "literal_translation": "An objection: if the world in its pre-manifest seed state is accepted and body too is called unmanifest in that sense, then Sankhya causal Pradhana seems admitted. Reply: that would follow only if we accepted an independent pre-state as cause. We do not; this pre-state is dependent on the Lord. Yet it must be admitted, since without a power-state, divine creation would be unintelligible, and the non-recurrence of the liberated is explained through the burning of that seed-power by knowledge. This unmanifest seed-power is ignorance-based, resting in the Lord, maya-like, a great sleep in which transmigrating beings lie without awakening to their true nature. Scripture elsewhere indicates this under terms such as akasha, aksara, and maya. Since maya cannot be neatly fixed as identical with or different from reality, it is called unmanifest. Hence \"beyond the great is the unmanifest\" means that the great arises from that unmanifest dependence. Whether \"great\" is taken as Hiranyagarbha-intellect or as the empirical self, the same dependence holds. The superiority of unmanifest over great is figuratively transferred to body as its effect; and among body, senses, etc., body is designated by avyakta because the others are already named by their own terms and body remains as residual referent.",
    "technical_translation": "Critical distinction: Vedanta accepts causal latency (avidya-maya-bija) only as Isvara-adhina, never as autonomous pradhana. The passage integrates cosmology, liberation logic, and scriptural cross-references to akasha/aksara/maya, then re-anchors avyakta as dependent causal condition with contextual transfer to the body-term.",
    "interpretive_note": "Strongest anti-Sankhya clarification: dependent maya-latency is not independent Pradhana."
  },
  "analysis": {
    "lexical_notes": [
      {
        "headword_iast": "adhikaraṇa",
        "gloss": "topical unit of argument",
        "contextual_sense": "Tracks each block inside the section-level inferential sequence",
        "grammatical_role": "noun",
        "alternate_glosses": [
          "topic-unit",
          "argument node"
        ]
      }
    ],
    "argument_tags": [
      "objection",
      "response",
      "resolution",
      "definition"
    ]
  },
  "provenance": {
    "extraction_timestamp_utc": "2026-06-02T16:24:50Z",
    "extractor_version": "extract_bs_records.py@0.1",
    "translator_version": "human+llm@bs-c01-s04-curation-pass-8",
    "reviewer_version": "pending",
    "source_manifest_path": "reality/src/logos/sankara/raw/manifest.jsonl"
  },
  "qa": {
    "status": "draft",
    "confidence": 0.72,
    "uncertainty_notes": [
      "Curated against local adhikarana flow and neighboring translated blocks.",
      "A final philological pass can still refine register and Sanskrit term granularity."
    ]
  }
}
