{
  "record_id": "SKR.BS.1.4.020",
  "work_code": "BS",
  "section_code": "1.4",
  "source": {
    "source_url": "https://advaitasharada.sringeri.net/display/bhashya/BS/devanagari?id=BS_C01&page=1",
    "source_sha256": "3e25449a44a0e912318db91030eb2e604e0c4eb2f8b5ceaa4ff4f92ae5e5bb80",
    "language": "sa",
    "script": "Devanagari",
    "edition_note": "Draft block record from BS_C01_S04.json::BS_C01_S04_V08_B2 (bhashya)."
  },
  "text": {
    "source_text": "नानेन मन्त्रेण श्रुतिमत्त्वं साङ्ख्यवादस्य शक्यमाश्रयितुम् । न ह्ययं मन्त्रः स्वातन्त्र्येण कञ्चिदपि वादं समर्थयितुमुत्सहते । सर्वत्रापि यया कयाचित्कल्पनया अजात्वादिसम्पादनोपपत्तेः , साङ्ख्यवाद एवेहाभिप्रेत इति विशेषावधारणकारणाभावात् । चमसवत् — यथा हि ‘ अर्वाग्बिलश्चमस ऊर्ध्वबुध्नः ’ (बृ. उ. २ । २ । ३) इत्यस्मिन्मन्त्रे स्वातन्त्र्येणायं नामासौ चमसोऽभिप्रेत इति न शक्यते नियन्तुम् , सर्वत्रापि यथाकथञ्चिदर्वाग्बिलत्वादिकल्पनोपपत्तेः , एवमिहाप्यविशेषः ‘ अजामेकाम् ’ इत्यस्य मन्त्रस्य । नास्मिन्मन्त्रे प्रधानमेवाजाभिप्रेतेति शक्यते नियन्तुम् ॥ ८ ॥",
    "transliteration_iast": "nānena mantreṇa śrutimattvaṃ sāṅkhyavādasya śakyamāśrayitum | na hyayaṃ mantraḥ svātantryeṇa kañcidapi vādaṃ samarthayitumutsahate | sarvatrāpi yayā kayācitkalpanayā ajātvādisampādanopapatteḥ , sāṅkhyavāda evehābhipreta iti viśeṣāvadhāraṇakāraṇābhāvāt | camasavat — yathā hi ‘ arvāgbilaścamasa ūrdhvabudhnaḥ ’ (bṛ. u. 2 | 2 | 3) ityasminmantre svātantryeṇāyaṃ nāmāsau camaso'bhipreta iti na śakyate niyantum , sarvatrāpi yathākathañcidarvāgbilatvādikalpanopapatteḥ , evamihāpyaviśeṣaḥ ‘ ajāmekām ’ ityasya mantrasya | nāsminmantre pradhānamevājābhipreteti śakyate niyantum || 8 ||",
    "segmentation_note": "Block-level extraction from BS_C01_S04_V08/BS_C01_S04_V08_B2."
  },
  "translation": {
    "literal_translation": "This mantra cannot be used to establish scriptural authority for Sankhya doctrine. The mantra is not capable, by independent force, of securing any one doctrine. Since by various constructions one can make notions like 'unborn' fit in different ways, there is no decisive ground to fix that Sankhya alone is intended here. It is like the 'camasa' passage: just as in 'a cup with opening below and base above' one cannot independently determine this or that specific cup as intended, because such features can be variously imagined, so too here there is no specificity in the mantra 'one unborn.' Therefore one cannot determine that this mantra intends pradhana alone as aja. (8-bhashya)",
    "technical_translation": "Siddhanta denies standalone doctrinal determinacy of the Svetasvatara mantra. A mantra lacking decisive contextual constraints cannot function as exclusive support for a system-ontology when multiple semantic constructions are possible. The 'camasa' analogy formalizes this underdetermination: descriptive predicates without restricting markers do not yield fixed referent identity. Hence the aja-mantra cannot be monopolized as pradhana-proof; Sankhya's claim to unique shruti-basis remains unestablished.",
    "interpretive_note": "Refutation via semantic underdetermination: polyvalent imagery cannot bear exclusive metaphysical assignment."
  },
  "analysis": {
    "lexical_notes": [
      {
        "headword_iast": "adhikaraṇa",
        "gloss": "topical unit of argument",
        "contextual_sense": "Tracks each block inside the section-level inferential sequence",
        "grammatical_role": "noun",
        "alternate_glosses": ["topic-unit", "argument node"]
      }
    ],
    "argument_tags": ["response", "resolution"]
  },
  "provenance": {
    "extraction_timestamp_utc": "2026-06-02T16:24:50Z",
    "extractor_version": "extract_bs_records.py@0.1",
    "translator_version": "human+llm@bs-c01-s04-curation-pass-2",
    "reviewer_version": "pending",
    "source_manifest_path": "reality/src/logos/sankara/raw/manifest.jsonl"
  },
  "qa": {
    "status": "draft",
    "confidence": 0.76,
    "uncertainty_notes": [
      "Camasa analogy is rendered as a general hermeneutic argument against exclusive fixation.",
      "Final Sanskrit nuance of avadharana is compressed into 'cannot be determined' phrasing."
    ]
  }
}
