{
  "record_id": "SKR.BS.1.4.045",
  "work_code": "BS",
  "section_code": "1.4",
  "source": {
    "source_url": "https://advaitasharada.sringeri.net/display/bhashya/BS/devanagari?id=BS_C01&page=1",
    "source_sha256": "3e25449a44a0e912318db91030eb2e604e0c4eb2f8b5ceaa4ff4f92ae5e5bb80",
    "language": "sa",
    "script": "Devanagari",
    "edition_note": "Draft block record from BS_C01_S04.json::BS_C01_S04_V16_VERSETEXT_01 (versetext)."
  },
  "text": {
    "source_text": "जगद्वाचित्वात् ॥ १६ ॥",
    "transliteration_iast": "jagadvācitvāt || 16 ||",
    "segmentation_note": "Block-level extraction from BS_C01_S04_V16/BS_C01_S04_V16_VERSETEXT_01."
  },
  "translation": {
    "literal_translation": "Because the word denotes the world. (16)",
    "technical_translation": "Sutra 1.4.16: the key expression is read as world-denoting (jagad-vacitva), so the intended knower-to-be is the maker of the whole world, i.e., Paramesvara.",
    "interpretive_note": "Sutra condenses the semantic pivot from local activity to total-world reference."
  },
  "analysis": {
    "lexical_notes": [
      {
        "headword_iast": "adhikaraṇa",
        "gloss": "topical unit of argument",
        "contextual_sense": "Tracks each block inside the section-level inferential sequence",
        "grammatical_role": "noun",
        "alternate_glosses": ["topic-unit", "argument node"]
      }
    ],
    "argument_tags": ["resolution"]
  },
  "provenance": {
    "extraction_timestamp_utc": "2026-06-02T16:24:50Z",
    "extractor_version": "extract_bs_records.py@0.1",
    "translator_version": "human+llm@bs-c01-s04-curation-pass-5",
    "reviewer_version": "pending",
    "source_manifest_path": "reality/src/logos/sankara/raw/manifest.jsonl"
  },
  "qa": {
    "status": "draft",
    "confidence": 0.86,
    "uncertainty_notes": [
      "Literal preserves aphoristic force.",
      "Technical gloss assumes prior adoption of the jagat-reading in the bhashya block."
    ]
  }
}
