{
  "record_id": "SKR.BS.1.1.024",
  "work_code": "BS",
  "section_code": "1.1",
  "source": {
    "source_url": "https://advaitasharada.sringeri.net/display/bhashya/BS/devanagari",
    "source_sha256": "3e25449a44a0e912318db91030eb2e604e0c4eb2f8b5ceaa4ff4f92ae5e5bb80",
    "language": "sa",
    "script": "Devanagari",
    "edition_note": "Auto-extracted draft from Sringeri HTML witness"
  },
  "text": {
    "source_text": "यदपि केचि दा हुः — प्रवृत्तिनिवृत्तिविधितच्छेषव्यतिरेकेण केवलवस्तुवादी वेदभागो नास्तीति , तन्न । औपनिषदस्य पुरुषस्यानन्यशेषत्वात् । योऽसा वु पनिषत्स्वेवा धिगतः पुरुषो ऽसंसारी ब्रह्म स्वरूपः उत्पाद्यादि चतुर्विधद्रव्यविलक्षणः स्वप्रकरणस्थो ऽनन्य शेषः , नासौ नास्ति नाधिगम्यत इति वा शक्यं वदितुम् । ‘ स एष नेति नेत्यात्मा ’ (बृ. उ. ३ । ९ । २६) इत्यात्मशब्दात् आत्मनश्च प्रत्याख्यातुमशक्यत्वात् , य एव निराकर्ता तस्यैवात्मत्वात् । न न्वात्मा अहं प्रत्ययविषयत्वादुपनिषत्स्वेव विज्ञायत इत्यनुपपन्नम् । न , तत्साक्षित्वेन प्रत्युक्तत्वात् । न ह्य हंप्रत्ययविषय कर्तृव्यतिरेकेण तत्साक्षी सर्व भूतस्थः सम एकः कूटस्थ नित्यः पुरुषो विधिकाण्डे तर्कसमये वा केनचिदधिगतः सर्वस्या त्मा । अतः स न केनचित्प्रत्याख्यातुं शक्यः , विधि शेषत्वं वा नेतुम् ; आत्मत्वा दे व च सर्वेषाम् — न हेयो नाप्युपादेयः । सर्वं हि विनश्यद्विकारजातं पुरुषान्तं विनश्यति । पुरुषो हि विनाशहेत्वभावा दविनाशी । विक्रिया हेत्वभावाच्च कूटस्थनित्यः । अत एव नित्यशुद्धबुद्धमुक्तस्वभावः ; तस्मात् ‘ पुरुषान्न परं किञ्चि त्सा काष्ठा सा परा गतिः ’ (क. उ. १ । ३ । ११) ‘ तं त्वौ पनिषदं पुरुषं पृच्छामि ’ (बृ. उ. ३ । ९ । २६) इति चौ पनिषदत्व विशेषणं पुरुषस्योपनिषत्सु प्राधान्येन प्रकाश्यमानत्वे उपपद्यते । अतो भूतवस्तुपरो वेदभागो नास्तीति वचनं साहसमात्रम् ॥",
    "transliteration_iast": "",
    "segmentation_note": "Auto-segmented from HTML block id=BS_C01_S01_V04_B4 class=bhashya"
  },
  "translation": {
    "literal_translation": "DRAFT literal translation pending philological pass.",
    "technical_translation": "DRAFT technical translation pending doctrinal terminology review.",
    "interpretive_note": ""
  },
  "analysis": {
    "lexical_notes": [
      {
        "headword_iast": "todo-term",
        "gloss": "pending",
        "contextual_sense": "Add lexical analysis during translation pass.",
        "grammatical_role": "unknown",
        "alternate_glosses": []
      }
    ],
    "argument_tags": [
      "definition"
    ]
  },
  "provenance": {
    "extraction_timestamp_utc": "2026-06-01T11:27:43.626182Z",
    "extractor_version": "generate_bs_draft_records.py@0.1",
    "translator_version": "human+llm@draft",
    "reviewer_version": "pending",
    "source_manifest_path": "ref/sankara/raw_full_safe/manifest.jsonl"
  },
  "qa": {
    "status": "draft",
    "confidence": 0.25,
    "uncertainty_notes": [
      "Auto-generated from BS_C01_S01_V04_B4; translation not started.",
      "Source witness should be cross-checked against critical edition before approval."
    ]
  }
}
