{
  "record_id": "SKR.BS.1.1.022",
  "work_code": "BS",
  "section_code": "1.1",
  "source": {
    "source_url": "https://advaitasharada.sringeri.net/display/bhashya/BS/devanagari?id=BS_C01&page=1",
    "source_sha256": "3e25449a44a0e912318db91030eb2e604e0c4eb2f8b5ceaa4ff4f92ae5e5bb80",
    "language": "sa",
    "script": "Devanagari",
    "edition_note": "Draft block record from BS_C01_S01.json::BS_C01_S01_V04_B4 (bhashya)."
  },
  "text": {
    "source_text": "यदपि केचि दा हुः — प्रवृत्तिनिवृत्तिविधितच्छेषव्यतिरेकेण केवलवस्तुवादी वेदभागो नास्तीति , तन्न । औपनिषदस्य पुरुषस्यानन्यशेषत्वात् । योऽसा वु पनिषत्स्वेवा धिगतः पुरुषो ऽसंसारी ब्रह्म स्वरूपः उत्पाद्यादि चतुर्विधद्रव्यविलक्षणः स्वप्रकरणस्थो ऽनन्य शेषः , नासौ नास्ति नाधिगम्यत इति वा शक्यं वदितुम् । ‘ स एष नेति नेत्यात्मा ’ (बृ. उ. ३ । ९ । २६) इत्यात्मशब्दात् आत्मनश्च प्रत्याख्यातुमशक्यत्वात् , य एव निराकर्ता तस्यैवात्मत्वात् । न न्वात्मा अहं प्रत्ययविषयत्वादुपनिषत्स्वेव विज्ञायत इत्यनुपपन्नम् । न , तत्साक्षित्वेन प्रत्युक्तत्वात् । न ह्य हंप्रत्ययविषय कर्तृव्यतिरेकेण तत्साक्षी सर्व भूतस्थः सम एकः कूटस्थ नित्यः पुरुषो विधिकाण्डे तर्कसमये वा केनचिदधिगतः सर्वस्या त्मा । अतः स न केनचित्प्रत्याख्यातुं शक्यः , विधि शेषत्वं वा नेतुम् ; आत्मत्वा दे व च सर्वेषाम् — न हेयो नाप्युपादेयः । सर्वं हि विनश्यद्विकारजातं पुरुषान्तं विनश्यति । पुरुषो हि विनाशहेत्वभावा दविनाशी । विक्रिया हेत्वभावाच्च कूटस्थनित्यः । अत एव नित्यशुद्धबुद्धमुक्तस्वभावः ; तस्मात् ‘ पुरुषान्न परं किञ्चि त्सा काष्ठा सा परा गतिः ’ (क. उ. १ । ३ । ११) ‘ तं त्वौ पनिषदं पुरुषं पृच्छामि ’ (बृ. उ. ३ । ९ । २६) इति चौ पनिषदत्व विशेषणं पुरुषस्योपनिषत्सु प्राधान्येन प्रकाश्यमानत्वे उपपद्यते । अतो भूतवस्तुपरो वेदभागो नास्तीति वचनं साहसमात्रम् ॥",
    "transliteration_iast": "yadapi keci dā huḥ — pravṛttinivṛttividhitaccheṣavyatirekeṇa kevalavastuvādī vedabhāgo nāstīti , tanna | aupaniṣadasya puruṣasyānanyaśeṣatvāt | yo'sā vu paniṣatsvevā dhigataḥ puruṣo 'saṃsārī brahma svarūpaḥ utpādyādi caturvidhadravyavilakṣaṇaḥ svaprakaraṇastho 'nanya śeṣaḥ , nāsau nāsti nādhigamyata iti vā śakyaṃ vaditum | ‘ sa eṣa neti netyātmā ’ (bṛ. u. 3 | 9 | 26) ityātmaśabdāt ātmanaśca pratyākhyātumaśakyatvāt , ya eva nirākartā tasyaivātmatvāt | na nvātmā ahaṃ pratyayaviṣayatvādupaniṣatsveva vijñāyata ityanupapannam | na , tatsākṣitvena pratyuktatvāt | na hya haṃpratyayaviṣaya kartṛvyatirekeṇa tatsākṣī sarva bhūtasthaḥ sama ekaḥ kūṭastha nityaḥ puruṣo vidhikāṇḍe tarkasamaye vā kenacidadhigataḥ sarvasyā tmā | ataḥ sa na kenacitpratyākhyātuṃ śakyaḥ , vidhi śeṣatvaṃ vā netum ; ātmatvā de va ca sarveṣām — na heyo nāpyupādeyaḥ | sarvaṃ hi vinaśyadvikārajātaṃ puruṣāntaṃ vinaśyati | puruṣo hi vināśahetvabhāvā davināśī | vikriyā hetvabhāvācca kūṭasthanityaḥ | ata eva nityaśuddhabuddhamuktasvabhāvaḥ ; tasmāt ‘ puruṣānna paraṃ kiñci tsā kāṣṭhā sā parā gatiḥ ’ (ka. u. 1 | 3 | 11) ‘ taṃ tvau paniṣadaṃ puruṣaṃ pṛcchāmi ’ (bṛ. u. 3 | 9 | 26) iti cau paniṣadatva viśeṣaṇaṃ puruṣasyopaniṣatsu prādhānyena prakāśyamānatve upapadyate | ato bhūtavastuparo vedabhāgo nāstīti vacanaṃ sāhasamātram ||",
    "segmentation_note": "Block-level extraction from BS_C01_S01_V04/BS_C01_S01_V04_B4."
  },
  "translation": {
    "literal_translation": "As for those who say there is no Vedic section that teaches mere reality apart from injunction, prohibition, and their auxiliaries - not so. The Upanishadic Person is non-subsidiary. That Person known only in the Upanishads - non-samsarin, Brahman in nature, distinct from the fourfold producible/acquirable/modifiable/performable categories, and established in its own context - cannot be denied as nonexistent or unknowable. Since sruti says 'this self is not this, not this,' and since self cannot be denied (the denier is that very self), it cannot be rejected. One may object: self is already known in the 'I' cognition, so saying it is known only in Upanishads is untenable. Reply: that has already been answered - the Upanishadic teaching concerns the witness distinct from the egoic knower-object, the one equal, present in all beings, immutable and eternal, not otherwise established in injunction-section or mere reasoning. Therefore it cannot be reduced to injunction-subsidiary status, and being self of all it is neither to be rejected nor newly appropriated. All changing entities up to personhood perish; the Person is imperishable due to absence of causes of destruction, and immutable due to absence of causes of modification. Hence eternally pure, conscious, and free. Therefore qualifiers like 'nothing beyond the Person' and 'I ask about that Upanishadic Person' are proper: the Person is primarily revealed in Upanishads. So the claim that no Vedic portion teaches an already existent reality is mere rashness.",
    "technical_translation": "Bhashya asserts a bhuta-vastu-paratva of Upanishad: the auopanishada purusha is ananya-shesha and irreducible to ritual hermeneutics; self-evident yet not fully disclosed apart from sruti-witness teaching.",
    "interpretive_note": "Affirms a distinct revelatory domain for Upanishad beyond action-text economy."
  },
  "analysis": {
    "lexical_notes": [
      {
        "headword_iast": "adhikaraṇa",
        "gloss": "topical unit of argument",
        "contextual_sense": "Tracks each block inside the section-level inferential sequence",
        "grammatical_role": "noun",
        "alternate_glosses": [
          "topic-unit",
          "argument node"
        ]
      }
    ],
    "argument_tags": [
      "response",
      "resolution",
      "definition"
    ]
  },
  "provenance": {
    "extraction_timestamp_utc": "2026-06-02T16:24:50Z",
    "extractor_version": "extract_bs_records.py@0.1",
    "translator_version": "human+llm@bs-c01-s01-curation-pass-3",
    "reviewer_version": "pending",
    "source_manifest_path": "reality/src/logos/sankara/raw/manifest.jsonl"
  },
  "qa": {
    "status": "draft",
    "confidence": 0.85,
    "uncertainty_notes": [
      "Curated in contiguous S01 pass with stable inferential-tag schema.",
      "A later philological pass should revisit condensed Mimamsa technical vocabulary and long polemical sentence boundaries in records 1.1.016-1.1.023."
    ]
  }
}
