{
  "record_id": "SKR.BS.1.1.071",
  "work_code": "BS",
  "section_code": "1.1",
  "source": {
    "source_url": "https://advaitasharada.sringeri.net/display/bhashya/BS/devanagari?id=BS_C01&page=1",
    "source_sha256": "3e25449a44a0e912318db91030eb2e604e0c4eb2f8b5ceaa4ff4f92ae5e5bb80",
    "language": "sa",
    "script": "Devanagari",
    "edition_note": "Draft block record from BS_C01_S01.json::BS_C01_S01_V19_VERSETEXT_01 (versetext)."
  },
  "text": {
    "source_text": "अस्मिन्नस्य च तद्योगं शास्ति ॥ १९ ॥",
    "transliteration_iast": "asminnasya ca tadyogaṃ śāsti || 19 ||",
    "segmentation_note": "Block-level extraction from BS_C01_S01_V19/BS_C01_S01_V19_VERSETEXT_01."
  },
  "translation": {
    "literal_translation": "And in this one, scripture teaches his union with That. (19)",
    "technical_translation": "Sutra 1.1.19: tadyoga-upadesha in this context establishes anandamaya as Brahman and not a lower referent.",
    "interpretive_note": "Sutra close for the fearlessness-through-identity argument."
  },
  "analysis": {
    "lexical_notes": [
      {
        "headword_iast": "adhikaraṇa",
        "gloss": "topical unit of argument",
        "contextual_sense": "Tracks each block inside the section-level inferential sequence",
        "grammatical_role": "noun",
        "alternate_glosses": [
          "topic-unit",
          "argument node"
        ]
      }
    ],
    "argument_tags": [
      "resolution"
    ]
  },
  "provenance": {
    "extraction_timestamp_utc": "2026-06-02T16:24:50Z",
    "extractor_version": "extract_bs_records.py@0.1",
    "translator_version": "human+llm@bs-c01-s01-curation-pass-9",
    "reviewer_version": "pending",
    "source_manifest_path": "reality/src/logos/sankara/raw/manifest.jsonl"
  },
  "qa": {
    "status": "draft",
    "confidence": 0.95,
    "uncertainty_notes": [
      "Curated in contiguous S01 pass with stable inferential-tag schema.",
      "A later philological pass should revisit tadyoga nuance and the heavily compressed debate text in records 1.1.069-1.1.071."
    ]
  }
}
