{
  "record_id": "SKR.BS.1.4.012",
  "work_code": "BS",
  "section_code": "1.4",
  "source": {
    "source_url": "https://advaitasharada.sringeri.net/display/bhashya/BS/devanagari?id=BS_C01&page=1",
    "source_sha256": "3e25449a44a0e912318db91030eb2e604e0c4eb2f8b5ceaa4ff4f92ae5e5bb80",
    "language": "sa",
    "script": "Devanagari",
    "edition_note": "Draft block record from BS_C01_S04.json::BS_C01_S04_V05_VERSETEXT_01 (versetext)."
  },
  "text": {
    "source_text": "वदतीति चेन्न प्राज्ञो हि प्रकरणात् ॥ ५ ॥",
    "transliteration_iast": "vadatīti cenna prājño hi prakaraṇāt || 5 ||",
    "segmentation_note": "Block-level extraction from BS_C01_S04_V05/BS_C01_S04_V05_VERSETEXT_01."
  },
  "translation": {
    "literal_translation": "If it be said, 'it speaks thus,' no; for it is the Pragna, because of the context. (5)",
    "technical_translation": "Sutra 1.4.5: even if one claims the cited language supports pradhana, that reading is rejected; contextual continuity establishes Pragna (the conscious supreme self) as the intended referent.",
    "interpretive_note": "Prakarana is decisive over isolated lexical overlap with Sankhya terms."
  },
  "analysis": {
    "lexical_notes": [
      {
        "headword_iast": "adhikaraṇa",
        "gloss": "topical unit of argument",
        "contextual_sense": "Tracks each block inside the section-level inferential sequence",
        "grammatical_role": "noun",
        "alternate_glosses": ["topic-unit", "argument node"]
      }
    ],
    "argument_tags": ["response", "resolution"]
  },
  "provenance": {
    "extraction_timestamp_utc": "2026-06-02T16:24:50Z",
    "extractor_version": "extract_bs_records.py@0.1",
    "translator_version": "human+llm@bs-c01-s04-curation-pass-1",
    "reviewer_version": "pending",
    "source_manifest_path": "reality/src/logos/sankara/raw/manifest.jsonl"
  },
  "qa": {
    "status": "draft",
    "confidence": 0.77,
    "uncertainty_notes": [
      "Literal preserves compact sutra style and may need coordination with your preferred idiom for cet references.",
      "Technical line depends on continuity with the adjacent bhashya objection-response structure."
    ]
  }
}
